{
  "report_id": "RPT-001",
  "video_id": "test_drive",
  "processing_mode": "batch",
  "duration_seconds": 21.63,
  "score": {
    "score": 850,
    "following_score": 82,
    "braking_score": 74,
    "acceleration_score": 100,
    "lane_behavior_score": 100,
    "interaction_score": 86,
    "incident_score": 82,
    "rating": "GOOD"
  },
  "behavior_events": [
    {
      "event_id": "BE-001",
      "behavior_type": "braking",
      "subject": {
        "type": "ego",
        "id": null
      },
      "start_frame": 210,
      "end_frame": 225,
      "start_time_seconds": 10.12,
      "end_time_seconds": 10.84,
      "magnitude": -4.8,
      "confidence": 0.94,
      "related_vehicle_ids": [
        24
      ],
      "evidence": {
        "reason": "Ego vehicle decelerated rapidly while following vehicle 24.",
        "peak_deceleration_mps2": -4.8,
        "min_time_headway_seconds": 0.91
      }
    }
  ],
  "incidents": [
    {
      "incident_id": "INC-001",
      "start_frame": 205,
      "end_frame": 228,
      "start_time_seconds": 9.88,
      "end_time_seconds": 10.99,
      "involved_vehicle_ids": [
        0,
        24
      ],
      "incident_type": "near_collision",
      "severity": "high",
      "confidence": 0.91,
      "related_behavior_event_ids": [
        "BE-001"
      ],
      "related_interaction_ids": [
        "INT-001"
      ],
      "evidence": {
        "minimum_distance_m": 2.4,
        "minimum_time_headway_seconds": 0.91,
        "ego_hard_braking": true
      }
    }
  ],
  "responsibility_assessments": [
    {
      "incident_id": "INC-001",
      "classification": "pov_primary",
      "confidence": 0.84,
      "reasoning": "The ego vehicle approached the lead vehicle too quickly and required hard braking to avoid a collision.",
      "evidence": {
        "ego_closing_rate_mps": 5.2,
        "ego_hard_braking": true,
        "lead_vehicle_abrupt_action": false
      }
    }
  ],
  "summary": "The drive was generally safe, but one high-risk following interaction resulted in hard braking and a near-collision.",
  "generated_at": "2026-09-08T14:00:00Z"
}